,TweetsEnglish
221,bring update branch operation please visit latest update faq covid related matter meanwhile pls stay safe take care time
222,hi zakeyjavis please refer faq website thank you
223,hi adisofri kindly refer faq deferment scheme via link thank you
224,deraman hi akashah deraman would appreciate could disregard dispose message intended recipient inconvenience caused much regretted thank you
225,x hi azlynn x kindly refer faq link regarding interest deferment scheme thank you
226,movement control order always help investment business banking need via online facility information contact u helpdesk ebiz com take care stay safe
227,hi kindly refer reply via pm thank you
228,hi may submit opt request april via sm complete form link thank you
229,hi would appreciate could send message via amonline retrieve account number detail thank you
230,hi kindly refer reply via pm thank you
231,hi everyone bring update automatic deferment loan financing payment meanwhile pls take care
232,nabeb hi nabeb deferment offer applicable loan financing denominated malaysian ringgit arrears day april may visit link faq thank you
233,hi movement control order contact center operation hour revised pm daily would appreciate could send message via amonline assistance thank you
234,hi may reply wish continue paying monthly installments usual thank you
235,hi sm ambank customer wish opt deferment scheme kindly reply wish opt scheme thank you
236,hi please contact ambank call center morning night help alternative please check account information via amonline thank you
237,assist hi kindly refer reply via pm thank you
238,hi kindly refer reply via pm thank you
239,hi sm sent ambank customer chooses postpone loan payment please reply message choose postpone loan payment thank you
240,hi derek wish to inform epf kiosk branch longer available thank you
241,hi accordance ambank call center movement control order operating morning day help check loan account information via amonline thank you
242,hi may call contact center operation hours pm daily assistance account details kindly send message via amonline thank you
243,hi access account information via twitter please send message via amonline review transaction status thank you
244,hi postponement scheme offered financing loan ringgit malaysia denomination without outstanding balance april april please visit site postponement scheme faq
245,hi postponement scheme offered financing loan ringgit malaysia denomination without outstanding balance april please refer postponement scheme faq thank you
246,hi miss send message via amonline help account thank you
247,hi please contact ambank call center morning review tac status thank you
248,happy best ambank hi help today
249,hi informed accord ambank call center movement control order operating morning day alternative check account information amonline thank you
250,hi informed accord ambank call center movement control order operating morning day alternative check account information amonline thank you
251,hi please contact ambank call center online review loan account thanks
252,hi please informed ambank call center line operates morning continue monthly installment payment usual postponement period please refer faq
253,good morning please see latest update branch operation visit latest development stay safe take care everyone
254,greeting ambank hi information kindly visit website link stay home stay safe regard
255,greeting ambank hi kindly informed offer applicable loan financing auto enrollment denominated malaysian ringgit balance overdue day april period month stay home stay safe
256,hi would appreciate being able to check loan balance via amonline thank you
257,hi may remit payment current month due date deferment scheme take effect april thank you
258,hi ensure confidentiality amp security unable to access account details via twitter kindly check loan payment status via amonline thank you
259,hi please visit the postponement scheme site thank you
260,official hi please visit postponement scheme site thank you
261,recently updated auto deferment individual sme loan financing repayment process amp faq customer wish opt auto deferment continue regular monthly installment visit detail stay safe
262,best wishes ambank hi please refer dm see feedback
263,greeting ambank hi would appreciate may refer dm reply feedback stay home stay safe regard
264,best wishes ambank hi please refer inbox see feedback
265,best wishes ambank hi please refer dm see feedback
266,best wishes ambank hi regarding interest interest please visit website information stay healthy
267,hi offer automatic registration financing loan ringgit malaysian ringgit without outstanding balance april april take care stay healthy much
268,assist greeting ambank hi would appreciate may refer dm reply feedback stay home stay safe regard
269,greeting ambank hi would appreciate may refer dm reply feedback stay home stay safe regard
270,best wishes ambank hi please refer inbox see feedback
271,greeting ambank hi kindly informed offer applicable loan financing auto enrollment denominated malaysian ringgit balance overdue day april stay home stay safe regard
272,hi may visit link personal loan details thank you
273,hi offer applicable loan financing denominated malaysian ringgit balance overdue day april thank you
274,hi offer financing loan malaysian ringgit denomination without outstanding balance april
275,hi offer financing loan malaysian ringgit denomination without outstanding balance april
276,hi please complete opt form disagree suspension scheme thank you
277,hi please provide full information via pm thank you
278,hi please provide full information via pm thank you
279,hi offer loan ringgit malaysia denomination without outstanding balance april information disagree please visit following website
280,hi kindly specify query request assistance thank you
281,hi offer applicable loan financing denominated malaysian ringgit balance overdue day april detail opt please visit thank you
282,hi offer applicable loan financing denominated malaysian ringgit balance overdue day april detail opt please visit thank you
283,greeting ambank hi kindly informed offer applicable loan financing auto enrollment denominated malaysian ringgit balance overdue day april stay home stay safe regard
284,happy birthday ambank hi please refer dm see feedback
285,greeting ambank hi would appreciate refer dm view reply feedback stay home stay safe regard
286,happy birthday ambank hi please refer dm see feedback
287,happy birthday ambank hi please refer dm see feedback
288,greeting ambank hi kindly informed offer applicable loan financing auto enrollment denominated malaysian ringgit balance overdue day april stay home stay safe regard
289,dear valued customer offering deferment individual sme loan financing repayment period six month effect april visit thank banking u stay safe take care
290,assist hi based latest announcement automatic moratorium repayment payment loan financing bank looking process stay tuned update official social medium account thank you
291,hi faiz wahab based latest announcement automatic moratorium payment bank financing loan reviewing process announce development official website social medium account
292,hi based latest announcement automatic moratorium repayment bank financing loan studying process announce development official website social medium account
293,hi based latest announcement automatic moratorium payment bank financing loan studying process announce development official website social medium account
294,dear fleur delie based latest announcement automatic moratorium repayment payment loan financing bank looking process stay tuned update official social medium account thank you
295,happy birthday ambank hi please refer inbox see feedback
296,whiskey greeting ambank hi whiskey sincere apology unpleasant experience encountered kindly allow u look matter shall respond good self accordingly regard
297,happy birthday ambank hi ask cooperation refer dm feedback
298,best wishes ambank hi apologize difficulty encountered please complete information dm action reference full name nric account holder contact contact
299,happy birthday ambank hi ask cooperation refer dm feedback
300,hi zeus apology inconvenience caused would appreciate could dm u personal detail checking matter regard
301,hi mohdzuraidy advise make report ambank branch nearby please bring money confirmation branch
302,hi sf ambank group offer temporary deferment installment repayment month may contact ambank contact center please dm u detail full name ic type financing contact number regard
303,happy birthday ambank hi mfco special payment scheme loan ambank
304,greeting ambank hi johan taharin ambank group offer temporary deferment installment repayment month may contact ambank contact center please dm u detail full name ic type financing contact number regard
305,good evening everyone bring urgent update branch operation meanwhile please remain home stay safe take care
306,greeting ambank hi ambank group offer temporary deferment scheme monthly installment repayment month would appreciate could contact ambank retail collection unit clarification stay safe
307,happy birthday ambank hi ambank offer temporary delay scheme ambank financing customer affected coronavirus outbreak please contact calling call center collection stay safe
308,happy birthday ambank hi ambank offer temporary delay scheme ambank financing customer affected coronavirus outbreak please contact calling call center collection stay safe
309,fadzil hi ramzdhan thank you please be safe wherever
310,fadzil greeting ambank hi ambank group offer temporary deferment scheme monthly installment repayment month would appreciate could contact ambank retail collection unit clarification please stay safe
311,hello ambank hi tn ambank offer temporary delay scheme ambank financing customer affected coronavirus outbreak please contact call call center collection stay safe
312,happy birthday ambank hi ambank offer temporary delay scheme ambank financing customer affected coronavirus outbreak please contact calling call center collection stay safe
313,greeting ambank hi would appreciate could immediately contact ambank contact center thank you
314,happy birthday ambank hi amirfaliq mj apologize difficulty encountered please submit vehicle registration number phone number via dm investigation ambank offer temporary delay scheme customer
315,greeting ambank hi yusri yusoff ambank group offer temporary deferment scheme monthly installment repayment month would appreciate could contact ambank retail collection unit clarification please stay safe
316,hello ambank hai fleur delie ambank offer temporary delay scheme ambank financing customer impressed coronavirus outbreak please contact call call center credit collection stay safe
317,greeting ambank assure ambank branch affected spread covid take serious precautionary measure ensure operation affected thank you
318,bnm special relief facility smes impacted covid available information please visit
319,doraaaaa advise vigilant share card information unknown party suspect card compromised immediately contact hour ambank call center regard
320,doraaaaa hi dora regard matter assure credible evidence card data leaked would like reassure take data privacy protection seriously amp constantly monitor card transaction unusual activity
321,sarikei advise vigilant share card information unknown party suspect card compromised immediately contact hour ambank call center regard
322,Sarikei hi Sarikei regard matter assure credible evidence card data leaked would like reassure take data privacy protection seriously amp constantly monitor card transaction unusual activity
323,advise vigilant share card information unknown party suspect card compromised immediate contact hour ambank call center regard
324,hi sauffie regard matter assure credible evidence card data leaked would like reassure take data privacy protection seriously amp constantly monitor card transaction unusual activity
325,hi regard matter assure credible evidence card data leaked reassure take data privacy protection seriously amp constantly monitor card transaction unusual activity
326,advise vigilant share card information unknown party suspect card compromised immediate contact hour ambank call center regard
327,hi ccm regard matter assure credible evidence card data leaked reassure take data privacy protection seriously amp constantly monitor card transaction unusual activity
328,suspect card compromised immediately contact hour ambank call center regard
329,advise vigilant share card information personal identification number pin cvv one time password transaction authorization code tac unknown party
330,would like to reassure take data privacy protection seriously constantly monitor card transaction unusual activity
331,hi ayim sincerely apologize delay response pertaining query said matter regard news circulating internet would like assure credible evidence credit debit card data leaked
332,hi n sincerely apologize confusion towards matter sent message regard date leaked issue may refer dm detail regard
333,hi aimi connection inquiry recommend contact ambank customer service center review
334,recommend contact ambank jam call center online review case customer service executive help confirming difficulty face
335,hi yes information please visit website link regard
336,hi eykajamaludin appreciate providing error message appearing screen advice
337,Samadi hi Afiqah appreciate providing error message appearing screen advice
338,hi wolfgang replied query may refer dm
339,mainah hi rahman mainah regret learn unpleasant experience encountered would appreciate could dm personal detail investigation said matter regard
340,tamin hi faqih tamin apologize difficulty know whether using mobile phone site application
341,best wishes ambank hi apologize difficulty experienced sent message personal inbox help thank you
342,greetings from ambank hi answered query via dm direct message reference regard
343,greeting ambank hi wish share retail collection hotline number pm monday thursday pm friday regard
344,hi zana issue rectified would appreciate may retry following troubleshooting step make sure phone high coverage restarted phone refresh network alternatively may swap sim another phone retry regard
345,greeting ambank hi muhammad fatrim please advised visit nearest ambank branch clarification amount charged regard
346,greeting ambank hi thank you feedback suggestion highlight matter management improvement future serve better thank you
347,greeting ambank hi believe issue rectified suggest may retry let u know issue still persists thank you
348,happy birthday ambank hi senget information payment receipt issued payment made proposal check payment status amonline application
349,best wishes ambank hi suggestion check balance vehicle rental financing account alternative amonline application contact ambank clock call center online
350,greeting ambank hi wish share accumulated ambonus point applicable viewed monthly statement amonline application e statement column regard
351,hi tengku alauddin please inform auto financing applicable new used car please visit nearest ambank branch proceed application regard
352,greeting ambank hi sincere apologize late respond dm kindly informed replied dm accordingly concerning query would appreciate may refer dm regard
353,zainol greeting ambank hi zainol apologize delay giving feedback please note action confirm relevant section
354,greeting ambank hi replied dm accordingly regard
355,greeting ambank hi nurlidiah sincere apology unpleasant experience encountered would appreciate could provide detail investigation via pm private message full name contact number regard
356,happy share local amp international award recognition continuous effort serve amp meet need respective market amp commitment towards business excellence amp customer satisfaction thank dear customer continuous support u
357,best wishes ambank hi apologize difficulty faced please note developed matter relevant section action difficulty faced
358,hi may walk nearest ambank branch account opening detail saving account product may refer link regard
359,earlier morning lion dance troop visited menara ambank chairman tan sri azman hashim senior management team fellow colleague customer ground watch entertaining lion dance huat ah everyone
360,hi ainn appreciate providing detailed description problem faced advice
361,amal hi miss regret learn unpleasant experience encountered branch apology inconvenience caused would appreciate could dm u personal detail branch location checking incident regard
362,sharif greeting ambank hi sharif please note relevant ambank branch process check accordingly however recommend confirm ambank branch check status
363,good news fit bank note chinese new year rm rm bank note available via atm machine selected ambank branch nationwide jan till jan visit info
364,kickstarted year metal rat hosting client networking amp appreciation dinner miri last week chief economist dr anthony das shared market outlook mr james yong svp sarawak region opened insightful session
365,"Hi Ummu, still a problem, apologize for the inconvenience"
366,double entry win trip japan need submit nric wechat official account exclusively ambank mastercard credit cardholder campaign period october till january amp c visit
367,double entry win trip japan need submit nric wechat official account exclusively ambank mastercard credit cardholder campaign period october till january amp c visit
